url,title,topics,crawl_timestamp,domain,content_length,content
https://www.denvergov.org/Government/Agencies-Departments-Offices/Agencies-Departments-Offices-Directory/Department-of-Transportation-and-Infrastructure/About-DOTI,DOTI Directory,"['trash', 'recycling', 'waste', 'compost', 'safety']",2025-01-07T18:29:04.217984,www.denvergov.org,6200,"DOTI Directory About DOTI To report an issue or outage, or to ask about city services, please submit a ticket online or by calling 311 so your request can be tracked for response and resolution. Summary Org Chart (June 2024) (PDF, 133KB) Bidding, Contracts, Prequalification www.work4denver.com 201 W. Colfax Ave Dept. 614 Denver, CO 80202 Construction and Current Projects To find project manager and contact forms for active projects, see a current list on our website . Fleet Management Roslyn Campus 5440 Roslyn Street, Building C Denver, CO 80216 Phone: (720) 865-3900 Fax: (720) 865-4158 Central Platte Campus 1271 W Bayaud Avenue, Building 5 Denver, CO 80223 Phone: (720) 337-1196 Fax: (720) 337-1205 Fueling Locations Privacy Notice Privacy Notice Regarding Use of Video and Audio Captured by City and County of Denver’s Fleet Telematics and Dashcam System The City and County of Denver is committed to protecting your individual privacy and securing your personal information made available to us when you interact with us. The City and County of Denver has installed dashcams with internal and external facing cameras to support Executive Order 65 Operational Safety and Health Memorandum A (PDF, 144KB) ’s purpose to promote safe driving behavior. While this system is intended to support an employee safe driving program, it may capture still images or recordings of the general public while in operation. Report Traffic Signal or Sign Problems During business hours: Call 311 Outside of normal business hours: For problems with current stop signs, yield signs and one-way signs, contact the Denver Police Department non-emergency line at (720) 913-2000. Read more about traffic signs and signals Request Open Records from DOTI Colorado Open Records Act The City and County of Denver is committed to making city government open, accountable and accessible to the public. The City’s approach to the Colorado Open Records Act (CORA) is an important part of its pledge to transparency to build trust with our residents. These guidelines help City agencies and departments provide the public with efficient access to documents and records pursuant to the Colorado Revised Statutes, C.R.S. §24-72-205(6). Making a Records Request Requesters must submit a request to the agency that is the custodian of the record itself. The City does not maintain a central repository for public records or a single office that fulfills requests. PLEASE NOTE: A CORA request received after 3 p.m. or any day that the agency is officially closed will be considered received on the following working day. CORA Costs To pay for the cost of processing a CORA request, the agency may charge for the time spent to research and respond to requests for records under CORA. Time and Cost Estimates Agencies may provide the requester with a time and cost estimate, which may require a pre-payment before processing the request. If you pay for more time than is spent processing your request, you will receive a refund. Document Format Documents may be available in their native format if they do not need to be redacted or if they can be readily accessed. Documents such as databases or spreadsheets that can be sorted or searched will be available in a similar format. The City will not provide documents in a format that requires providing software or that would violate the terms of any agreement or rights held by a third party, such as licensing agreements or copyrights. To request Open Records from the Department of Transportation and Infrastructure (DOTI), please complete this form. If the form is not loading, please refresh your browser window or open in a new window . Click here to view form. Parking and Enforcement Information denvergov.org/parking To Report Complaints of Violations of the Public Right-of-Way, please call 311 Paving and Street Sweeping Information Weekly Paving Updates: denvergov.org/denverpaving Report a pothole: Online Call 311 Street Sweeping See your schedule and sign up for reminders online Main Office 1271 West Bayaud Avenue Denver, CO Asphalt Plant 5440 Roslyn St Denver CO Recycling, Compost and Trash Services denvergov.org/trashandrecycling Service requests: Denver Utilities Online Report an Issue Call 311 General recycling questions: DenverRecycles@denvervov.org Keep Denver Beautiful www.denvergov.org/kdb Graffiti Prevention and Removal www.denvergov.org/graffiti Phone: (303) 446-3557 Administrative Offices 2000 W. 3rd Avenue Denver, CO 80223 Right-of-Way Permits and Inspection www.denvergov.org/rows Right-of-Way Construction Inspection 2000 W. 3rd Avenue 3rd Floor Denver, CO 80223-1027 Phone: (303) 446-3469 Fax: (303) 446-3442 Email: pwpermits@denvergov.org Wastewater Construction Inspection 2000 W. 3rd Avenue Denver, CO 80223-1027 Phone: (303) 446-3469 Right-of-Way Engineering and Regulatory 201 W. Colfax Avenue Dept. 507 Denver, CO 80202 Phone: (720) 865-3003 Email: DOTI.ER@denvergov.org Survey & Addressing 201 W. Colfax Avenue Dept. 507 Denver, CO 80202 Phone: (720) 865-3002 Survey email: John.Clarke@denvergov.org Addressing email: addressing@denvergov.org DOTI Permit Operations 2000 W. 3rd Avenue Denver, CO 80223 Phone: (303) 446-3759 Email: dotipermitoperations@denvergov.org Department of Transportation and Infrastructure Permit Operations phones are CLOSED from 7:30 a.m. to 9:30 a.m. every Thursday. Development Services/Site Engineering 201 W. Colfax Avenue Dept. 203 Denver, CO 80202 Phone: (720) 865-2982 Email: developmentservices@denvergov.org Wastewater Customer Service denvergov.org/wastewater Backups Wastewater Operations (303) 446-3400 Billing Information Wastewater Customer Service (303) 446-3500 Storm Drainage Water Quality/Storm Drainage (303) 446-3400 Quality Control Wastewater Operations (303) 446-3400 2000 West 3rd Avenue Denver, CO 80223 Business Hours: 7:30 a.m. - 4:00 p.m. Main Office: (303) 446-3400 Contact 3-1-1 Report an Issue Call 3-1-1 Outside Denver: (720) 913-1311 Hearing Impaired Only (TTY): (720) 913-8479 For Emergencies: 9-1-1 Visit Other Denver Sites Share & Connect The Denver Local is your resource for city news and information directly to your inbox. Sign up to stay informed! Follow Us On Social"
https://www.denvergov.org/Government/Agencies-Departments-Offices/Agencies-Departments-Offices-Directory/Community-Planning-and-Development/Building-Codes-Policies-and-Guides,Building and Fire Code,['community'],2025-01-07T18:29:04.217984,www.denvergov.org,5904,"Building and Fire Code Building Codes, Policies and Guides The Denver Building and Fire Code establishes the minimum, mandatory standards for building construction in Denver. Denver's code is based on international standards for safe, habitable structures. Denver has adopted the 2021 ICC (International Code Council) codes listed below. You are responsible for ensuring that your project complies with ICC codes as well as Denver's amendments to the ICC codes, which are located in the Denver Building and Fire Code. The links below will take you to an external site hosted by the ICC. Denver also abides by the 2023 edition of the National Electrical Code (NEC), which is adopted at the state level. Building code policies The policies listed below clarify existing codes and detail how to handle certain situations that are not clearly addressed within current codes. Building code policies for the 2019 code are available for download below: Building guides The following guides are available for download in PDF format: Presentation and panel discussion from December 9, 2020. View checklists and fact sheets Archived Denver building codes Archived Denver Building Code Amendments are available for download below. The Denver Green Code First adopted in 2019, the Denver Green Code is based on the International Green Construction Code. Starting in May 2023, the city will begin requiring commercial and multifamily development to meet some provisions from this code, while allowing projects the flexibility to choose which specific provisions to implement. Learn about the Denver Green Code Energy Code Checklists Working hand in hand with the Denver community, the city has defined and adopted bold climate goals. Adoption of more stringent building codes to achieve higher building performance is integral to attaining these goals. CPD's energy code checklists are designed to support project teams in navigating complexities of the energy code, and succeeding in delivering projects that support our community’s expressed priorities. A commercial checklist is required for all commercial and multi-family residential construction projects. Projects using the Performance Path are required to use the two files for the energy modeling report. A residential checklist is required for: Download the appropriate checklist based on your project type: Commercial IECC Prescriptive Checklist (XLSX, 153KB) Commercial IECC Performance Checklist (XLSX, 147KB) Commercial ASHRAE Prescriptive Checklist (XLSX, 151KB) Commercial ASHRAE Performance Checklist (XLSX, 143KB) Commercial Energy Code Modeling Report (PDF, 312KB) Residential IECC Prescriptive Checklist (XLSX, 82KB) Residential IECC Performance Checklist (XLSX, 78KB) Residential ERI Checklist (XLSX, 78KB) Learn how to fill out and submit the correct IECC checklist: Commercial checklist webinar (opens in YouTube), View slide deck (PDF, 5MB) Residential checklist webinar (opens in YouTube), View slide deck (PDF, 4MB) A commercial checklist is required for all commercial and multi-family residential construction projects 10,000 sf or larger. Projects using the Performance Path are required to use the two files for the energy modeling report. A residential checklist is required for: Download the appropriate checklist based on your project type: Commercial Denver Energy Code Prescriptive Checklist (XLSX, 4MB) Commercial Denver Energy Code Performance Checklist (XLSX, 910KB) 90.1 Appendix G Compliance Form Denver Energy Code Companion Tool (XLSM, 4MB) Denver Modeling Rules and Procedures (PDF, 1MB) Please choose the file type that you prefer to work in for the following residential checklists: New! Proposed Systems Example Table Templates (DOCX, 67KB) Residential Denver Energy Code Prescriptive Checklist (New Construction) (DOCX, 136KB) Residential Denver Energy Code Prescriptive Checklist (Additions and Alterations) (DOCX, 91KB) Residential Denver Energy Code Total Building Performance Checklist (DOCX, 118KB) Residential Denver Energy Code Energy Rating Index Checklist (DOCX, 119KB) OR Residential Denver Energy Code Prescriptive Checklist (New Construction) (XLSX, 59KB) Residential Denver Energy Code Prescriptive Checklist (Additions and Alterations) (XLSX, 56KB) Residential Denver Energy Code Total Building Performance Checklist (XLSX, 56KB) Residential Denver Energy Code Energy Rating Index Checklist (XLSX, 56KB) Learn how to fill out and submit the correct IECC checklist: Commercial checklist webinar (opens in YouTube) Residential checklist webinar (opens in YouTube) Fact sheets for commercial projects: Appendix PT: Performance Target (PDF, 207KB) Appendix SE: Site-Energy (PDF, 181KB) Electric Ready (PDF, 175KB) Solar Ready (PDF, 172KB) Electrification for Service Water Heating (PDF, 178KB) EV Supply Equipment (PDF, 156KB) Electrification for Space Heating (PDF, 178KB) C406: Prescriptive Pathway (PDF, 698KB) C407 Performance Pathway (PDF, 142KB) Partial Electrification for Alterations (PDF, 441KB) Fact sheets for residential projects: Compliance Pathway Options (PDF, 156KB) Electric Ready Requirements (PDF, 151KB) Electric Vehicle (EV) Charging Requirements (PDF, 151KB) Energy Rating Index Option (PDF, 171KB) Minimum Renewables (PDF, 163KB) Prescriptive Compliance Option (PDF, 146KB) Solar Ready Requirements (PDF, 155KB) Total-Building Performance Option (PDF, 160KB) Building Code Appeals To appeal a decision made regarding the building code, you must apply to the Board of Appeals. The Board of Appeals is an independent body that reviews: Board of Appeals Additional Information Contact 3-1-1 Report an Issue Call 3-1-1 Outside Denver: (720) 913-1311 Hearing Impaired Only (TTY): (720) 913-8479 For Emergencies: 9-1-1 Visit Other Denver Sites Share & Connect The Denver Local is your resource for city news and information directly to your inbox. Sign up to stay informed! Follow Us On Social"
https://www.denvergov.org/Government/Agencies-Departments-Offices/Agencies-Departments-Offices-Directory/Recycle-Compost-Trash/Large-Item-Pickup,Large Item Pickup,"['trash', 'recycling', 'waste', 'compost']",2025-01-07T18:29:04.217984,www.denvergov.org,3287,"Large Item Pickup Denver Solid Waste Management collects large or bulky items. Solid Waste is moving to every-other-week recycling collection and every-nine-week large item pickup service starting January 2025 while it accelerates the rollout of compost citywide. Check the calendar below and sign up for reminders so you never miss a collection! Schedule Large Item Pickup is scheduled on the same day as your regular trash and recycling collection. A maximum of 5 large items (such as furniture) and up to 10 bags will be collected from each service address. Find your day in the Trash and Recycling app or use the online lookup. Step 1. Enter your service address Step 2. Look for the Large Item entry on the Calendar view. Collection Instructions 10 additional bags of trash are accepted for Large Item Pickup. At all other times bags of trash should go in your cart for collection. If you have an excess of extra trash that does not fit in your cart, please submit a request for a larger cart on your Denver Utilities Online account . What items are accepted for Large Item Pickup? Large items are bulky items that are safe for disposal but cannot fit in a trash cart. Acceptable items include: Items not accepted for Large Item Pickup include: Remember! The City has collection programs available for household hazardous waste , paint recycling , appliances , and electronic waste . Additionally, the Cherry Creek Recycling Drop-off is available for excess recycling and compostable material. There are also extensive networks of donation opportunities to give items new life. Search the Waste Directory to learn more. Large Item Pickup Questions How do I check my Large Item Pickup schedule? Enter your address here or download the free Denver Trash and Recycling App. Sign up for service alerts so you never miss a collection! What other collection opportunities are there? Solid Waste Management will hold annual Fall and Spring clean up days. Residents can bring additional large items for disposal, as well as hard-to-recycle materials for diversion. Details coming soon. Remember! The City has collection programs available for household hazardous waste , paint recycling , appliances , and electronic waste . Additionally, the Cherry Creek Recycling Drop-off is available for excess recycling and compostable material. There are also extensive networks of donation opportunities to give items new life. Search the Waste Directory to learn more. Drop Off Locations These private trash drop-off facilities in the metro Denver area can accept household trash and large items (furniture, mattresses, etc.) for a fee . Recycling drop-off sites can be found in the online Recycling Directory. Call ahead to check hours and fees. North Denver East Denver South & Southwest Denver <scribe-shadow id=""crxjs-ext"" style=""position: fixed; width: 0px; height: 0px; top: 0px; left: 0px; z-index: 2147483647; overflow: visible; visibility: visible;""></scribe-shadow> Facebook Contact 3-1-1 Report an Issue Call 3-1-1 Outside Denver: (720) 913-1311 Hearing Impaired Only (TTY): (720) 913-8479 For Emergencies: 9-1-1 Visit Other Denver Sites Share & Connect The Denver Local is your resource for city news and information directly to your inbox. Sign up to stay informed! Follow Us On Social"
https://www.denvergov.org/Government/Agencies-Departments-Offices/Agencies-Departments-Offices-Directory/Recycle-Compost-Trash/Cart-Service-Guidelines,Cart Set-Out and Service Guidelines,"['trash', 'recycling', 'waste', 'compost']",2025-01-07T18:29:04.217984,www.denvergov.org,3650,"Cart Set-Out and Service Guidelines Please follow these cart set-out and service guidelines to help us safely and effectively collect your carts. Set out your trash, recycle, and compost carts for by 7 a.m. on your collection day , but no earlier than 7 p.m. the night before. Collection vehicles will not be able to return for late set-outs. Cart Set-out Requirements How do I request a different cart size? If you are a current compost customer or not filling up your trash cart on a weekly basis, here's how to downsize your cart: 1. Manage your cart through your Denver Utilities Online account. 2. Request a cart exchange by calling 311 3. Exchange in person at the SWM Cart Maintenance Facility: 2013 S. Osage St. Denver, CO 80223 Monday-Friday 8:00 am - 2:00 pm Residents MUST bring their current cart to swap at the Cart Maintenance Facility. Moving out or moving in? Resident's Responsibilities and Right-of-Way Obstructions Residents are responsible for: The Department of Transportation and Infrastructure and Parks and Recreation remind homeowners that they are responsible for trees on the public right-of-way. If a Public Right-of-Way (PROW) tree or tree part is blocking a roadway, it must be removed immediately. Removal can occur one of three ways: Residents are responsible for the removal and disposal of tree stumps and all branches over 4 inches in diameter and/or 4 feet in length. Tree branches and stumps under 4 inches in diameter and less than 4 feet in length should be composted. Setting Out Your Cart for Collection To find out your cart set out location enter your home address at our Schedules and Reminders page or please contact our Customer Service team directly at 311 (720-913-1311). CURB SET OUT: ALLEY SET OUT: Storing Your Cart on Non-Collection Days All service carts must be stored on your property, out of public view as best as you can on non-collection days. All trash, recycling, and compost carts must be stored on your property in between collections. You may set your carts out as early as the night before your collection day and then return your carts to your property within a day after collection occurs. Keeping carts out of the alley and off the streets will: It is your responsibility to manage and care for your city-issued carts. Take pride in your neighborhood and bring your carts back. Street Sweeping Day Instructions What do I do when my collection is on the same day as my scheduled street sweeping? When your collection day and street sweeping day are both scheduled for the same day you have three options for setting out your containers. Option 1: Set your containers on the apron (edge) of your driveway. Option 2: Set your containers off the street on the edge of the curb-line. Option 3: Set your containers on the opposite side of your street. Moving your containers off the street on sweeping days will reduce the in & out ""snaking"" by the sweepers and enable the Department of Transportation and Infrastructure to keep your street clean. Expanded Collection Denver expanded solid waste services in 2023 with a new fee based on trash cart size. Weekly recycling and invoicing began in January and compost service will rollout starting in summer 2023. Rebates are available based on income and household size. Learn more about services, fees and rebates Quick Links: Contact 3-1-1 Report an Issue Call 3-1-1 Outside Denver: (720) 913-1311 Hearing Impaired Only (TTY): (720) 913-8479 For Emergencies: 9-1-1 Visit Other Denver Sites Share & Connect The Denver Local is your resource for city news and information directly to your inbox. Sign up to stay informed! Follow Us On Social"
https://www.denvergov.org/Government/Agencies-Departments-Offices/Agencies-Departments-Offices-Directory/Recycle-Compost-Trash,"Trash, Recycle & Compost","['trash', 'recycling', 'waste', 'compost']",2025-01-07T18:29:04.217984,www.denvergov.org,3423,"Trash, Recycle & Compost The City and County of Denver's Solid Waste Division provides collection for household trash, recycling and compost for more than 250,000 residents. Beginning the week of January 6, 2025, solid waste collection will operate on the following schedule to accelerate the rollout of compost citywide: If your carts were not collected on schedule, please leave them out at the designated setout location . Check for status updates in the Trash & Recycling app. Trash, Recycle, Compost: Collection Schedules and Guidelines View your Solid Waste Management service schedule, sign up for reminders, see guidelines for collection. Denver Utilities Online Pay bills online, make trash/recycle/compost services requests, and manage multiple addresses. New and existing customers will receive information by mail about updating and creating accounts to pay invoices. Apply for Rebates See if you are eligible for rebates for solid waste services and the new sidewalk program. Trash rebate participants who receive a stormwater bill will automatically receive the sidewalk rebate. Existing trash rebate recipients do not need to re-apply until their current trash rebate ends. Cart Set-Out and Service Guidelines How and when to set out your trash, recycle, and compost carts for collection, plus guidelines for cart requests, moving instructions, street sweeping conflicts and storage tips. Cart Services Request Status Check the current service times for cart related requests: upsize/downsize, damaged carts, lost/stolen and more. Large Item Pickup Large item pickup service will occur every 9 weeks, on the same day of the week as your regular trash collection day, for a maximum of 5 large items and up to 10 bags. Find your next scheduled pick up day. Trash Waste directory, large item and extra trash collection, drop-off information for excess trash, Denver Housing Authority Recycle Don't waste the good stuff, with Denver's single stream recycling collection. Learn more about what we accept by searching the Recycling Directory and checking electronics recycling guidelines. Compost Learn more about Denver’s compost service and the citywide compost rollout. Seasonal Programs Mulch Giveaway, LeafDrop, Learn to Compost Classes, Treecycle, Recycle Your Holiday Lights, compost, mulch, location, guidelines, recycle, cherry creek drop off Expanded Waste Collection As of January 2023, residents of the City and County of Denver now pay for Trash services based on trash cart size. Additional Services Appliances, Dead Animal Collection, Hazardous Waste, Graffiti Removal Resources Waste Hauler Licensing, waste reduction education, apartment and commercial recycling, Keep Denver Beautiful, Denver Public Schools, 2020 Solid Waste Master Plan Billing Questions, Account Transfers & Customer Service Solid Waste Customer Care offices are open from 7:30 a.m.-3:30 p.m. Monday through Thursday. Submit billing questions through your Denver Utilities Online account or by emailing swmbillinginquiries@denvergov.org . Want reminders, notifications and updates about your services? Get the App Contact 3-1-1 Report an Issue Call 3-1-1 Outside Denver: (720) 913-1311 Hearing Impaired Only (TTY): (720) 913-8479 For Emergencies: 9-1-1 Visit Other Denver Sites Share & Connect The Denver Local is your resource for city news and information directly to your inbox. Sign up to stay informed! Follow Us On Social"
