url,title,topics,crawl_timestamp,domain,content_length,content
https://www.denvergov.org/Government/Agencies-Departments-Offices/Agencies-Departments-Offices-Directory/Denver-City-Council/Council-Members-Websites-Info/District-4,Diana Romero Campbell,"['community', 'safety']",2025-01-07T18:29:04.217984,www.denvergov.org,3139,"Diana Romero Campbell Council Member, District 4 Council Pro Tem Diana Romero Campbell was elected on April 4th, 2023, as the Denver City Council Member for District 4, Southeast Denver. She was elected to serve as Council Pro Tem on July 15, 2024. Diana, having grown up and raised her family in Southeast Denver, brings a grounded perspective, deep understanding, and commitment to the unique landscape of the district. She is dedicated to parks and recreation, and preserving the Highline Canal as a community asset. Diana partners with stakeholders to ensure a safe and affordable community for all and engages with residents, from the youngest to older adults, to build a community with respect, joy, and collaboration. Diana's career is dedicated to ensuring all children, youth, and families have access to equal opportunities. Her advocacy in early care and education, youth development, out-of-school programs, and family support reflects her community values. Diana believes change happens by listening to all voices, treating everyone with respect and dignity, uplifting historically marginalized people, and following both data and heart. For more information on projects and initiatives in District 4, please visit the informational tiles below. District 4 Neighborhoods include: Hampden, Hampden South, Wellshire, University Hills, Goldsmith, Southmoor Park, and Kennedy. Find your Council District Find your Zone District Find your Registered Neighborhood Organization District 4 Accomplishments (Coming soon) Community Resources South by Southeast Community Festival Wellshire 100th Anniversary Neighborhood Info & Community Safety Planning, Visioning & Infrastructure Projects Private Development & Business Parks, Trails & Golf Older Adult Resources Arts & Culture 311 and Online Services Hub Get Help Now Denver 311 provides residents with an effortless, accessible way to navigate City services. Report an issue Sign-up for Street Sweeping Reminders Contact District 4 Location: 7555 E. Hampden Ave, Ste. 325 Denver, CO 80231 Telephone: (720) 337- 4444 Email: district4@denvergov.org Macy Conant, Chief of Staff macy.conant@denvergov.org Kathy Gile, Senior Council Aide kathy.gile@denvergov.org District 4 Newsletters Sign up for the District 4 newsletter 'Southeast Denver Scoop' Newsletter Archive: For access to archived newsletters, please contact macy.conant@denvergov.org or call (720) 337- 4444. Office Hours Councilwoman Romero Campbell wants to hear from you! Visit our office 9:00 am - 5:00 pm Monday through Friday (except on city holidays). Schedule a 15-minute appointment by contacting macy.conant@denvergov.org or by calling (720) 337- 4444. Committees and Boards Councilwoman Romero Campbell sits on the following committees: Councilwoman Romero Campbell also sits on the following boards: Contact 3-1-1 Report an Issue Call 3-1-1 Outside Denver: (720) 913-1311 Hearing Impaired Only (TTY): (720) 913-8479 For Emergencies: 9-1-1 Visit Other Denver Sites Share & Connect The Denver Local is your resource for city news and information directly to your inbox. Sign up to stay informed! Follow Us On Social"
https://www.denvergov.org/Government/Agencies-Departments-Offices/Agencies-Departments-Offices-Directory/Department-of-Housing-Stability/Resident-Resources/Find-Shelter,Find Shelter,"['community', 'environment']",2025-01-07T18:29:04.217984,www.denvergov.org,8057,"Find Shelter Overview HOST is activating 24/7 cold weather shelter from 1 p.m. Monday, Dec. 30 through 11 a.m. Monday, Jan. 13 at the Stone Creek shelter (former Best Western hotel), 4595 Quebec St. and at city facilities located at 2601 W. 7 th Ave., and 375 S. Zuni St. The St. Charles Recreation Center, 3777 Lafayette St., will provide overnight shelter from 8 p.m. to 7 a.m. beginning the evening of Jan. 7 through the morning of Monday, Jan 13. St. Charles will open after 9 p.m. Friday, Jan. 10 due to previously scheduled programming. Individuals in need of shelter are encouraged to go to “front door” shelter access points: • For individual men – Denver Rescue Mission Lawrence Street Community Center, 2222 Lawrence St. • For individual women – Samaritan House, 2301 Lawrence St. • For youth ages 15-20 – Urban Peak, 1630 S. Acoma St. • Families in need of shelter should call the Connection Center at 303-295-3366. A printable flier of this information is available here. (PDF, 119KB) The Department of Housing Stability (HOST) partners with many agencies citywide to provide shelter for people experiencing homelessness. There are many shelter facilities throughout the city, so rather than requiring people in crisis to navigate a complex system, we have identified specific centrally-located facilities as the “front door” access to the entire system. These locations have longer hou rs for intake and have transportation available to other facilities. They can also help people navigate which shelter facility is the best option for their individual situation. HOST is now offering a free circulator bus service for persons experiencing homelessness from 8:30 a.m. to 3:30 p.m. Monday through Friday. See the route, stops, and services here (PDF, 97KB) / en español (PDF, 90KB) . See also this list of rider expectations (PDF, 47KB) / en español (PDF, 51KB) . Walk-up Shelter Access & “Front Door” Referral Centers If you or someone you know is in housing crisis and needs shelter urgently, please refer them to “front door” facilities, where we offer both walk-up access and have the ability to refer (and sometimes transport) to other shelters as appropriate. Walk-up only centers do not refer to other facilities. Find this information in printable form here. (PDF, 190KB) Walk-up Shelter Access & ""Front Door"" Referral Centers in Denver For individual men : Front door : Lawrence Street Community Center, 2222 Lawrence St., (303) 294-0157, 7 a.m. to 8 p.m. daily, it is advised to arrive before 6 p.m. for transportation to other locations; Walk-up access only: Crossroads, 1901 29th St., (720) 305-4640, entry from  8 a.m. to 8 p.m. daily, no transportation to other shelters from this location For individual women: Front door : Samaritan House, 2301 Lawrence St., (303) 294-0241, 4:30 p.m. to 7:30 a.m. daily, it is advised to arrive between 4 and 4:30 p.m. for shelter or transportation to other locations For families with minor children: Access to family shelters through The Salvation Army Connection Center Phone Intake & Eligibility: (303) 295-3366, 7 a.m. to 9 p.m. Monday through Friday, 8 a.m. to 12 p.m. Saturday and Sunday For youth ages 15-20: Walk-up access only : Urban Peak The Mothership, 1630 S. Acoma, (303) 974-2928, 8 a.m. to 7 p.m.* Monday through Friday, 10 a.m. to 7 p.m.* Saturdays and Sundays. *Closed on Wednesdays from 12 p.m. – 5 p.m., on all other weekdays from 4 p.m. – 5 p.m., and on weekends from 1:30 p.m. – 4 p.m. For those experiencing domestic violence: SafeHouse Denver, 24-hour crisis hotline (303) 318-9989 Service Animals and Pets: Service animals are allowed in our shelters. Alternately, Denver Animal Protection offers a Safe Haven Program, which provides two to four weeks of shelter for pets of families experiencing homelessness and during severe weather events. See the Save Haven site for more information. Other Shelter Facilities These providers are also part of Denver’s shelter network, but do not transport to other facilities, and are therefore not recommended “front door” entry points. Locations listed here without an address are NOT walk-up facilities. Delores Project: women and transgender individuals, (303) 534-5411, beds are assigned only by phone at 10 a.m. daily Day Centers and Supportive Services These facilities are available for people to access during daytime business hours listed, but are NOT overnight shelters. A brief description of services and supports provided is included below. The City of Denver has endeavored to offer a range of alternatives to traditional congregate shelters. The alternatives include options for couples, people with pets, transgender individuals, people with health conditions, people who are recovering from COVID, families, people living in a vehicle, and other extenuating circumstances. These programs are limited and have waiting lists, and are NOT walk-up accessible. To access these programs, please work with an outreach worker or case manager at one of the “front door” shelters or a day center for a referral. St. Francis Center , 2323 Curtis St., (303) 297-1576 7 a.m. to 3 p.m. Monday, Tuesday, Thursday, Friday, 7 a.m. to 1 p.m. Wednesday, and 7 a.m. to 2 p.m. Saturday and Sunday Lawrence Street Community Center , 2222 Lawrence St., (303) 294-0157 7 a.m. to 8 p.m. daily The Gathering Place (serving women, transgender and nonbinary individuals , and children ) 1535 N. High St., (303) 321-4198 8:30 a.m.-5:00 p.m. Mondays, Wednesdays, Thursdays and Fridays; 8:30am - 1:30pm Tuesdays Volunteers of America Mission , 2877 Lawrence St., (303) 297-0408 8:30-11:30 a.m. Mondays through Thursdays Haven of Hope , 1101 West 7th Ave., (303) 607-0855 7 a.m. to 1 p.m. Mondays through Fridays Urban Peak Drop-In Center , 1630 S Acoma St., (303) 974-2928 8 a.m. to 7 p.m.* Monday through Friday, 10 a.m. to 7 p.m.* Saturdays and Sundays. *Closed on Wednesdays from 12 p.m. – 5 p.m., on all other weekdays from 4 p.m. – 5 p.m., and on weekends from 1:30 p.m. – 4 p.m. Senior Support Services , 846 East 18th Ave., (303) 832-1622 9 a.m. to 2 p.m. Mondays through Fridays Seniors age 60+. Lunch served 11:30 a.m. to 12:30 p.m. Access Points Throughout Metro Denver Access Points are locations where those experiencing homelessness can access Metro Denver’s Coordinated Entry System (CES). The purpose of Coordinated Entry is to ensure that people experiencing homelessness have equitable access to the housing resources they need to resolve their housing crisis. You can find all the Metro Denver Access Points here. Severe Weather Shelter Plans Severe weather poses a serious danger to those staying outside, and we encourage people to come inside. HOST, alongside shelter and outreach partners, monitors weather and shelter usage to activate severe weather protocols and shelter expansions as necessary. The City’s Emergency Operations Plan calls for the opening of recreation centers as warming locations during regular business hours, and additional overnight shelter to ensure capacity for everyone to come inside when temperatures are unsafe. The Denver Department of Public Health & Environment (DDPHE) is the lead agency in monitoring weather conditions and determining when temperatures indicate a need for severe weather activation. So that people in crisis do not have to figure out where shelter is available, people in need of shelter should be referred to the city’s “front door” shelter access points and will be transported to overnight shelter. If additional overflow shelter is activated, a banner will appear on the denvergov.org website and additional information will be posted at the top of this page. 2024-2025 Severe Weather Shelter Plan (PDF, 309KB) Related Links You May Also Find Helpful Contact 3-1-1 Report an Issue Call 3-1-1 Outside Denver: (720) 913-1311 Hearing Impaired Only (TTY): (720) 913-8479 For Emergencies: 9-1-1 Visit Other Denver Sites Share & Connect The Denver Local is your resource for city news and information directly to your inbox. Sign up to stay informed! Follow Us On Social"
https://www.denvergov.org/My-Property/Recycling-Compost-and-Trash,"Recycling, Compost, and Trash","['trash', 'recycling', 'waste', 'compost']",2025-01-07T18:29:04.217984,www.denvergov.org,1908,"Recycling, Compost, and Trash Get information on the city's recycling, compost, and trash services including collection schedules, cart guidelines, and managing your services online. Denver Utilities Online Accounts Manage solid waste billing accounts, pay online and submit service requests through Denver Utilities Online. Report Missed Pick-up Submit service requests for missed collections or cart exchanges through your Denvergov or Denver Utilities Online account. Find Schedules and Reminders Collection schedules and reminders for recycle, compost, and trash pickup and holiday schedules. Expanded Waste Collection Service Denver expanded solid waste services in 2023 with a new fee based on trash cart size and moved to weekly collection for all Solid Waste customers. Rebates are available based on income and household size. Learn more about services, fees, rebates and compost rollout. Recycling Recycling is now collected weekly for Denver Solid Waste Management customers. On average, Denverites recycle only 63% of the recyclable waste generated by their household each year. Small changes can make a huge difference! Trash Get information on weekly trash service for City and County of Denver Solid Waste customers. Large Item Pickup Information on monthly collection of large or bulky items for Denver Solid Waste Management customers. Compost Denver Solid Waste Management provides weekly compost collection for existing customers. New compost service is being added in phases throughout the city beginning in 2023. About 50% of what is currently thrown away can be composted! Contact 3-1-1 Report an Issue Call 3-1-1 Outside Denver: (720) 913-1311 Hearing Impaired Only (TTY): (720) 913-8479 For Emergencies: 9-1-1 Visit Other Denver Sites Share & Connect The Denver Local is your resource for city news and information directly to your inbox. Sign up to stay informed! Follow Us On Social"
https://www.denvergov.org/My-Property,My Property,"['trash', 'recycling', 'compost']",2025-01-07T18:29:04.217984,www.denvergov.org,1025,"My Property Property Information Find information related to your property including zoning, assessments, records, property values, and maps. Property Tax Get information on property taxes, including paying property taxes and property tax relief programs. Recycling, Compost, and Trash Get information on the city's recycling, compost, and trash services including collection schedules, cart guidelines, and managing your services online. Remodeling and Construction Find resources and services to assist in your remodeling and construction projects including e-permitting, zoning codes, and finding your zoning. Utilities Get resources and information on utility services through the City and County of Denver. Contact 3-1-1 Report an Issue Call 3-1-1 Outside Denver: (720) 913-1311 Hearing Impaired Only (TTY): (720) 913-8479 For Emergencies: 9-1-1 Visit Other Denver Sites Share & Connect The Denver Local is your resource for city news and information directly to your inbox. Sign up to stay informed! Follow Us On Social"
https://www.denvergov.org/Home,Home,"['waste', 'community', 'safety']",2025-01-07T18:29:04.217984,www.denvergov.org,6076,"Home Hot Topics Here are some of our most popular topics! These links will get updated to reflect what’s most relevant or as city services become more popular. 2024 Citywide Goals Report MyFriendBen Be a Snow Angel Treecycle Firearm-Related Harm Prevention Snow Removal Reuse Business Directory Inmate Search Marriages & Civil Unions City Highlights 2025 Minimum Wage 2025 Sidewalk Fees Energy Assistance Explore the Registry Top Services Adopt A Pet Building Permits City Jobs 2025 Solid Waste Schedules Denver Motor Vehicle Info Property Information Online Services Newsletter Signup Latest From Denver News Police officer understaffing will remain without improved strategies Published on January 07, 2025 DENVER – Opportunities for improvement persist for the Denver Police Department regarding officer retention, strategic planning, and community policing according to a follow-up report on a 2023 audit from Denver Auditor Timothy M. O’Brien, CPA. Denver Extends Severe Weather Shelter Published on January 06, 2025 Three extra shelters now open Monday, Dec. 30 through 11 a.m. Monday, Jan. 13. DDPHE Reminds Denverites About the Risks Associated with Cold Weather Published on January 06, 2025 Denver Parks and Recreation will open all currently operating recreation centers as daytime warming centers during regular business hours on Tuesday, Jan. 7, 2025, for people who need a place to warm up. Each center will have a designated area available for warming, with access to drinking water, restrooms, and a place to sit. Denver Turns 2024 Goals into Historic Progress, Releases New Report Published on January 06, 2025 Under Mayor Johnston’s leadership, Denver delivered historic reductions in homelessness, increased public safety, expanded affordable housing and more. Nightly Light and Music Show Schedule Published on January 06, 2025 Come down to Civic Center Park and be awed by lights, music. Mayor Mike Johnston Selects Al Gardner as Deputy Mayor Published on January 06, 2025 Mayor Mike Johnston today announced Al Gardner will serve as the new Deputy Mayor for Denver. In this one-year term, Gardner will continue in his role as executive director of General Services and will take on the Mayor's duties whenever Mayor Johnston is unable to do so. DOTI Rings in the New Year with Expanded Citywide Services Published on January 03, 2025 DOTI would like to remind residents of new and expanded services it’s kicking off in the new year, and where customers and property owners can access information about solid waste service changes and a new citywide sidewalk repair and construction program. Denver Extends Severe Weather Shelter Published on January 03, 2025 Three extra shelters now open Monday, Dec. 30 through 11 a.m. Wednesday, Jan. 8. Denver City Council Schedule & Hearings -- Week of January 6, 2025 Published on January 02, 2025 Denver City Council Schedule & Hearings -- Week of January 6, 2025 Social A post shared by City and County of Denver (@therealcityofdenver) Events Holiday Lights! January 07, 2025 [HOLIDAY] The City and County Building is decked out for the holidays!  Nightly, see an 8-minute light and music show at 5:45 pm & 6:45 pm with static lights between shows and until 10:45pm through the end of the Stock Show (1/26/2025). NOTE: NO MUSIC OR LIGHT SHOWS on Monday evenings, ONLY static light displays to not disrupt City Council meetings. Commission for People with Disabilities Meeting January 07, 2025 The Commission for People with Disabilities meets the first Tuesday of every month from 5:30pm to 7pm. Cherry Creek North Design Advisory Board Meeting January 08, 2025 Regular meeting of Cherry Creek North Advisory Board. Interview Tips & Tricks! January 08, 2025 Denver Workforce Development typically offers its popular Interview Tips & Tricks webinar on Wednesdays. Join us for some excellent interviewing tips so that you can show off your best qualities and feel empowered to succeed in your career journey! Wellness Winnie- St. Francis Center at the Comfort Inn January 08, 2025 Wellness Winnie is Denver’s mobile unit offering support, assistance, and resources to those in need, where they are. Wellness Winnie is staffed with mental health counselors and peer navigators. Through shared experiences, peer navigators are skilled to support recovery and mental well-being. Resume Tips & Tricks January 08, 2025 Denver Workforce Development typically offers its popular Resume Tips & Tricks webinar on Wednesdays. Join us soon for terrific resume-writing strategies and best practices for a tight, well-written resume that will help your credentials stand out from the rest . . . showcasing your best qualities! African American Commission Meeting January 08, 2025 Denver African American Commission Meetings are held the 1st Wednesday of the month from 3pm to 5pm. Youth Series: Resume Tips & Tricks January 08, 2025 Ready to create a resume that stands out? Join us online every other Wednesday from 4-4:30 p.m. for this introductory webinar designed for students aged 16-24! In just 30 minutes, we’ll walk you through the essentials of building a resume that grabs employers' attention. You’ll learn everything from choosing the right layout to highlighting your skills and experience in a way that makes you shine. American Indian Commission Meeting January 08, 2025 Monthly meetings take place on the second Wednesday of every month from 5pm to 6:30pm Denver 8 TV .embed-container { position: relative; padding-bottom: 56.25%; height: 0; overflow: hidden; max-width: 100%; } .embed-container iframe, .embed-container object, .embed-container embed { position: absolute; top: 0; left: 0; width: 100%; height: 100%; } Player Not Working? View Our Stream Below: Watch Denver 8 Live What's Near Me? Contact 3-1-1 Report an Issue Call 3-1-1 Outside Denver: (720) 913-1311 Hearing Impaired Only (TTY): (720) 913-8479 For Emergencies: 9-1-1 Visit Other Denver Sites Share & Connect The Denver Local is your resource for city news and information directly to your inbox. Sign up to stay informed! Follow Us On Social"
